scrape_date,username,tweet,url,likes_count,retweets_count,replies_count,compound,neg,neu,pos
2022-04-21,spacetwinks,"average american's current ideal job: ""one of those things where they test new drugs on you, but i at least get to play nba street while they do it""",https://twitter.com/spacetwinks/status/1517060192801890305,57,6,3,0.6486,0,0.831,0.169
2022-04-21,callingourshot,NBA: 2-0 (+1.61 U) ✅ Tatum O4.5 ASTS ✅ Vucevic DD MLB: 3-0 (+2.75 U) ✅ Phillies ML ✅ ARI/WSH NRFI ✅ Ohtani O4.5 K’s  5-0 ON THE DAY!🧹 LIKE IF YOU TAILED!👍,https://twitter.com/CallingOurShot/status/1517090769219301378,41,2,1,0.5882,0,0.876,0.124
2022-04-21,ibetyouxyz,#Utah Jazz 🆚 #Dallas Mavericks today!  Luka might be on the bench with a calf strain for most of this @NBA series.   Could this be a sweep for Gobert &amp; Mitchell or can Dallas overcome missing their best player? 🏆  Pick your side 👉  https://t.co/KwMeDqhdw8  #NBA #blockchain  https://t.co/hD34wxZz8f,https://twitter.com/ibetyouxyz/status/1517076764886978561,33,0,0,0.4753,0.071,0.835,0.094
2022-04-21,wsj,The sudden emergence of Jordan Poole next to Stephen Curry and Klay Thompson is a wrinkle that can flip the NBA playoffs   https://t.co/9HxcrHwKZj,https://twitter.com/WSJ/status/1517058066407202816,28,4,0,0,0,1,0
2022-04-21,hoopshype,"The best five players in the NBA in the last week, per @TikotDeRoa's Global Rating.  https://t.co/3EJvrN9cIm",https://twitter.com/hoopshype/status/1517070072358969344,24,4,0,0.6369,0,0.781,0.219
2022-04-21,lucilleburdge,Good morning. The Celtics odds to win the NBA Finals are +550.,https://twitter.com/LucilleBurdge/status/1517081493373435905,16,3,1,0.7717,0,0.599,0.401
2022-04-21,hoopshype,Who the hell is the favorite to win the NBA title right now?,https://twitter.com/hoopshype/status/1517076182356746240,16,2,24,0.296,0.215,0.467,0.318
2022-04-21,paxer89,"Italian big man Leonardo Okeke has declared for the NBA Draft. Okeke is averaging 9.4 points, 7.7 rebounds, and 1.2 blocks per game in the Italian second division this season.",https://twitter.com/paxer89/status/1517066856456232962,15,2,0,-0.2263,0.061,0.939,0
2022-04-21,jrichardgoodman,Nets go home win the next 2 everything changes all Boston did was hold serve ... NBA playoffs start when a road team wins ....,https://twitter.com/jrichardgoodman/status/1517078067369316355,15,4,4,0.8176,0,0.737,0.263
2022-04-21,egi_nupe_,That fine man contesting for NBA President has my vote. 😀,https://twitter.com/Egi_nupe_/status/1517059377412325377,15,1,12,0.2023,0,0.833,0.167
2022-04-21,feargiannis,So bored im playing Nba Live 14 😐  https://t.co/2hqxBFTju0,https://twitter.com/FearGiannis/status/1517069691415855104,14,0,4,-0.0847,0.229,0.574,0.197
2022-04-21,11w,"Skull Session: NIL collectives are changing college football, Cam Heyward and Terry McLaurin are media darlings, E.J. Liddell talks his first purchase with NBA money, and more.  https://t.co/QN5iGbS8yu",https://twitter.com/11W/status/1517065637293662208,12,0,0,0.4939,0,0.894,0.106
2022-04-21,rochiewbz,"This city is by far the best sports city in the world!  #RedSox Home Opener, incredible #Celtics #NBA Playoff Games(1 and 2), Emotional #JerryRemy Night at Fenway, the @bostonmarathon   Oh, and we’ve got the #NHLBruins #NERevs @NEFreeJacks college and HS sports  I love Boston!!!",https://twitter.com/RochieWBZ/status/1517093454106566657,12,2,1,0.9036,0,0.782,0.218
2022-04-21,chris_smoove,Durant 0-10 Clutch! Nets Blew 17 Pt Lead Game 2 vs Celtics! 2022 NBA Playoffs Nets vs Celtics  https://t.co/roZq7sz6fx via  @YouTube,https://twitter.com/Chris_Smoove/status/1517068192446828544,11,0,0,0,0,1,0
2022-04-21,sandraaleow,"the alfa is out there if you look - this was @nansen_ai @nansen_alpha's smart money tracker yesterday when NBA's ""the association NFT"" was trading for .11 ETH on secondary. the floor is currently at ~.3 ETH  https://t.co/nlp8R1QfOl",https://twitter.com/sandraaleow/status/1517082579467313152,10,0,2,0.4019,0,0.928,0.072
2022-04-21,fastestpayout,Letting 5 random people sign on my betting account and make a 5000 5 team NBA basketball 🏀 MLB parlay   If it wins you can keep the winnings   Like 👍 this tweet then DM and I will choose 5 of you randomly,https://twitter.com/FastestPayout/status/1517067424012640256,10,1,2,0.8658,0,0.767,0.233
2022-04-21,gatheringintel,Key Dates zur NBA Draft 2022: - 24.04. - Deadline for early entrants to declare for the draft - 13-15.05 NBA G-League Camp  - 16-22.05 Draft Combine - 17.05 Draft Lottery - 01.06 NCAA early entrant withdrawal deadline - 13.06 NBA early entrant withdrawal deadline - 23.06 Draft,https://twitter.com/GatheringIntel/status/1517069837863948289,9,0,0,0.0516,0,0.945,0.055
2022-04-21,wipmorningshow,Who is the best player in the NBA this season?,https://twitter.com/WIPMorningShow/status/1517083863985573888,9,2,8,0.6369,0,0.682,0.318
2022-04-21,wtfferg,@GlowHours_ @Equivernal @Mati1988123 @KellyMartin6 @bishoptiddyjake It’s like y’all want Lebron to beat the all nba first team every year 😭,https://twitter.com/WtfFerg/status/1517087377512189953,9,0,2,0.4215,0,0.817,0.183
2022-04-21,jrichardgoodman,"NBA is about dudes, coaching matters, and hiring ex players is risky vs nba coaches  players choosing or signing off on a coach they can run isn't a good thing",https://twitter.com/jrichardgoodman/status/1517076005571031041,8,0,1,-0.4777,0.139,0.825,0.036
2022-04-21,freakilyv,"@SeeSawRrr @FRBurnerAcct Casual. You clearly don't watch NBA games your whole life, start watching full games in 2013 Steph curry mate.🥴",https://twitter.com/FreakilyV/status/1517056867922374656,8,0,0,0.5423,0,0.809,0.191
2022-04-21,providecontext,"Fun to watch the entire NBA fanbase that was laughing at us for calling AC The Best Perimeter Defender/Best Role Player in the NBA…   Not so funny now is it? It’s almost like when your judgement isn’t clouded by Lebron/Lakers hate, you can see players for what they are.",https://twitter.com/ProvideContext/status/1517074181921325057,8,0,0,0.7165,0.126,0.668,0.205
2022-04-21,jags_2_riches,"A very Special Thank You to Mr. Ben Vallis from @CelticRedditPod. Amazing job, sir. It was an honor and privilege working with you.   Much love to, @pgaming_k @rashidjere13 and of course to the 🐐of Celtics YouTube, The One &amp; Only, @Real_BSmooth ☘️  #Celtics #NBAPlayoffs #NBA",https://twitter.com/Jags_2_Riches/status/1517074218181185537,7,1,1,0.9611,0,0.661,0.339
2022-04-21,nftwhalealert,P̳ast H̳our S̳tats S̳ales: WarKittens Genesis: 282  https://t.co/YSRIiZuSOs: 99 The Association NFT (NBA): 98 Metacraft Season Pass 2022: 63  V̳olume: CATGIRL ACADEMIA: Ξ3545.68 Zunks: Ξ727.00 Invisible Society XYZ: Ξ685.80 Project Kevins: Ξ652.12 Moonbirds: Ξ240.03,https://twitter.com/nftwhalealert/status/1517065617828106240,7,2,1,0,0,1,0
2022-04-21,abdulmahmud01,"This is stupid of the NBA. I paid my 2022 fee well ahead of the deadline and as I tweet, my seal hasn't been issued.",https://twitter.com/AbdulMahmud01/status/1517072628598587394,7,1,1,-0.3182,0.128,0.792,0.079
2022-04-21,gentris_jointe,"@NS95vr @JimmyKempski I love Jokic, but no. He was 21st in the league in pts in the clutch with 41 pts. Embiid was 1st with 96 pts. People talk about all the stats except the ones that matter. With the game on the line, no one in the NBA affected winning more than Embiid this year.",https://twitter.com/Gentris_Jointe/status/1517080107587969027,7,0,0,0.2144,0.116,0.756,0.129
2022-04-21,nbatahlilde,#NBA75'de Gecenin Play-off Programı:  🏀Timberwolves(1) - (1)Grizzlies 🕝02.30 📺S Sport  🏀Jazz(1) - (1)Mavericks 🕓04.00 📺NBA TV  🏀Nuggets(0) - (2)Warriors 🕔05.00  (21 Nisan 2022)  https://t.co/B7PjFi9iJj,https://twitter.com/NbaTahlilde/status/1517067079744167936,6,0,0,0,0,1,0
2022-04-21,sodo_esq,"Definitely  @YCMaikyauSAN  ! It’s very clear he is what the bar needs! The bar needs somebody accountable, brilliant, updated, fearless and passionate about the NBA, and that’s all YC. A man who knows that leadership is a service and a responsibility, and not a privilege✅",https://twitter.com/Sodo_Esq/status/1517063148141953024,6,5,0,0.9458,0,0.683,0.317
2022-04-21,chris_smoove,Joel Embiid Game Winner OT Revenge vs Raptors Game 3! 2022 NBA Playoffs Raptors vs 76ers  https://t.co/BxdcdHpKw5 via  @YouTube,https://twitter.com/Chris_Smoove/status/1517068190152634369,6,1,2,0.1759,0.139,0.694,0.167
2022-04-21,rontu1055,"Wall of fame of the fanart I created for my favorite project @LOcommunityNFT I included some rappers, artists, NBA players, etc. Much love LO Fam! @anthony_W3B @dicks_fish @therealKENNYWOO  https://t.co/cyEg4Pj3ZC",https://twitter.com/Rontu1055/status/1517088207728300033,6,1,1,0.908,0,0.65,0.35
2022-04-21,surecr7,"As I Dey see this play  off so , I will make my early decision   Warriors will win the NBA . The Suns are fvking up",https://twitter.com/surecr7/status/1517074851537858560,6,1,1,0.7615,0,0.753,0.247
2022-04-21,cheff_eth,I just got timed out of @NBA NFT discord for telling people the mint was not available anymore HAHAH helping people is a bad thing. #nft #NFTCommunity #NFTartist they are bitter because of the problem in the mint contract as the solution is to block people lmao,https://twitter.com/Cheff_eth/status/1517084299270721537,6,0,1,-0.7351,0.243,0.617,0.14
2022-04-21,chris_smoove,DeMar DeRozan 41 Pts Bulls Steal Game 2 vs Bucks! 2022 NBA Playoffs Bulls vs Bucks  https://t.co/hYEoa4yb5M via  @YouTube,https://twitter.com/Chris_Smoove/status/1517083416197541889,6,0,0,-0.5411,0.17,0.83,0
2022-04-21,arclegger,"Man the @NBA really nailed that Web2 ownership mentality in their ""NFT""  Please read ""Ownership""  https://t.co/CGIDtE7JRx",https://twitter.com/Arclegger/status/1517054775249956864,6,0,2,0.3182,0,0.867,0.133
2022-04-21,sportscardsfl,THURSDAY Morning B/S/T   🏀 NBA Western Conference Teams Only 🏀    1️⃣ Include price 2️⃣ Retweet for more 👀 3️⃣ Follow others  💵 Tip jar in profile 💵  #sportscardsfl   @TonysCards @TheHobby247 @sports_sell @84baseballcards @HobbyConnector  https://t.co/8CVBE0wsdY,https://twitter.com/sportscardsfl/status/1517065750921555969,5,7,35,0,0,1,0
2022-04-21,victoria_oloni,Are we going back to an NBA president that pays first year lawyers 30k? 🤔🤔🤔🤔🤔,https://twitter.com/Victoria_Oloni/status/1517071527090569217,5,4,3,0,0,1,0
2022-04-21,vsinlive,"Follow The Money is LIVE at 7 ET/4 PT! @MitchMossRadio and @paulyhoward recap yesterday’s action in the #NBA, #NHL, and #MLB. Then  they handicap the #NFL Draft and more with…  7:45 @ERSports1 8:30 @Seeley_Nigel 9:00 @MikePalmCirca 9:30 @MikeDetillier",https://twitter.com/VSiNLive/status/1517093955619356672,5,3,1,0,0,1,0
2022-04-21,nftwhalealert,P̳ast H̳our S̳tats S̳ales: The Association NFT (NBA): 108 The Weirdos: Battle Royale: 70 WarKittens Genesis: 53  V̳olume: Moonbirds: Ξ394.85 Bored Ape Yacht Club: Ξ145.00  https://t.co/ES42kqebpm Seed: Ξ93.05 Mutant Ape Yacht Club: Ξ68.00,https://twitter.com/nftwhalealert/status/1517080716240388096,5,1,1,-0.7003,0.185,0.815,0
2022-04-21,menderclub,"How about gifting this MenderNFT to you?   No.00 MenderNFT🪣，this is for you!!! 🏆🏆🏆salute, the real dunk king👑 @Double0AG  Although you are no longer in the Magic, your dunks remain in everyone's hearts Air Gordon! ✈😱  #MenderNFT #MenderShow #NBAxNFT #NBA #NFT  https://t.co/kXgC2tP7Hu",https://twitter.com/MenderClub/status/1517093337110835200,5,1,4,-0.5216,0.078,0.922,0
2022-04-21,cryptodesigirl,"Even NBA released $ETH NFT’s without research in solidity and turned into a victim for exploit.   Why can’t our marketers in USA stop them and offer blockchain service .   I’m going to send msg to every organization in USA , let them know about kadena and their NFT’s.  $KDA",https://twitter.com/cryptodesigirl/status/1517067538575724544,5,0,0,-0.5719,0.117,0.883,0
2022-04-21,hadarse,So great to meet NBA player james wiseman here in london.  Good luck man. You are great! 🏀💪  https://t.co/t0ZgrXkQhh,https://twitter.com/hadarse/status/1517090927961120769,5,0,0,0.943,0,0.5,0.5
2022-04-21,miroslavcuk,"While there's a crusade on Twitter against using analytics in the NBA, we are witnessing the most efficient era of basketball thanks to numbers being smartly used by all of the teams. Six guys made 27+ ppg on 60+% TS in both of the last two seasons. (1/2)",https://twitter.com/MiroslavCuk/status/1517065929376649216,5,0,1,0.8173,0,0.838,0.162
2022-04-21,dfswarstrike,REAPER TAKEDOWN🔥🔥 PrizePicks cashing! Great way to end the night! Make sure you come join my FREE discord and get in all the plays!! #DFS #DraftKings #PrizePicks #NBA #FanDuel   Discord:  https://t.co/YUjvEawwjL  https://t.co/fpoZiTLNi9,https://twitter.com/DFSWarstrike/status/1517068307479908353,4,0,0,0.886,0.117,0.541,0.342
2022-04-21,itsysltony,EARLY plays for today 👨🏽‍🍳✅  Russell - U24.5 PTS+AST Green - U23.5 PRA Jokic - U7.5 AST Gordon - U20.5 PTS+REB  Use Promo Code : YSLTONY If you are new to Underdog Fantasy‼️ Matches your first deposit up to $100!   #underdogfantasy #GamblingTwitter #NBA #Prizepicks #NBAPlayoffs  https://t.co/6gElVarEGh,https://twitter.com/ItsYsltony/status/1517056080123252736,4,1,0,0.3164,0,0.946,0.054
2022-04-21,hex_trust,It's time for Non-Fungible Thursday: your weekly mint of top #NFT headlines.   Featuring @LouisVuitton @NBA @moonbirds_xyz @coinbase  https://t.co/GgtakYucfU,https://twitter.com/Hex_Trust/status/1517072714183307264,4,0,1,0.2023,0,0.904,0.096
2022-04-21,rjdisidoro,Watching the death of NBA superteams and enjoying every second of it.,https://twitter.com/rjdisidoro/status/1517061470063759360,4,0,1,-0.128,0.225,0.578,0.197
2022-04-21,mwmikesports,🚨 PLAYER PROP 🚨   3U NBA (POD) 3U MLB (POD) (2) 2U NBA (2) 2U MLB 1U NBA PLAYER PROP  Parlays coming!   https://t.co/kfi8H8MrcE  https://t.co/McWuNEJttc,https://twitter.com/MWMikeSports/status/1517085752965873664,4,0,2,0,0,1,0
2022-04-21,teakeddfs,Jokic/Ja Morant PRA both under… 🤔  #PrizePicks #NBA  https://t.co/6JasywbhAD,https://twitter.com/TEAKEDDFS/status/1517064554324275201,4,0,2,0,0,1,0
2022-04-21,daoncbs,"☀️Thursday show: 6a ET: Wright retires 6:40: Embiid 😳 7: Thirsty Thurs.🍻 8: C’s 2️⃣ 9: @MuggsyBogues, 14-year NBA vet 9:30: Daniel Jeremiah (@MoveTheSticks), NFL Draft  📺:  https://t.co/aG5OFDdczo 🎙: @CBSSportsRadio 📡: SiriusXM 158 📱: CBS Sports/Audacy apps 🖲: “Play CBSSR”  https://t.co/ERchpfaLCE",https://twitter.com/DAonCBS/status/1517079587305537538,4,3,3,0,0,1,0
2022-04-21,senator_deo,"Wow!!!  Another beautiful law Week is here again!!!   11th Law Week Anniversary of the NBA Ado-Ekiti Branch scheduled to hold from the 25th April to 1st  May 2022.  Venue: Aare Afe Babalola Bar Center, High Court Complex Ado Ekiti.  https://t.co/Gz8QmStNpz",https://twitter.com/senator_Deo/status/1517086835348017153,4,3,1,0.871,0,0.811,0.189
2022-04-21,low6sports,"Following the launch of our games with the @PGATOUR, @NFL Cincinnati @Bengals and the @NBA @DetroitPistons, we have been shortlisted for ‘Mobile Gaming Software Supplier’ at the EGR Global B2B Awards 2022! 🏆  Full award shortlist 👇 #MakeYourPlay    https://t.co/xt8pDgnInr  https://t.co/W5jx5QtYSy",https://twitter.com/low6sports/status/1517078356281470977,4,2,0,0.7777,0,0.841,0.159
2022-04-21,finsports2,“Place Your Bets!” Who to take in #NBA Awards Season 📝Coach 📝6th Man 📝MIP  📝ROY 📝MVP 🎙@painsworth512 💵 x2 @mybookie code FINSPORTS  ✳️  https://t.co/Aa8bomcifS 🍎  https://t.co/Sk6Qeb7mqZ,https://twitter.com/FinSports2/status/1517090865860300802,4,4,0,0.5093,0,0.875,0.125
2022-04-21,edemirnba,"Josh Minott's versatility on both ends will make him a first round pick this year.  6'8""/205. Has an NBA body already. Crazy vertical jump. Long arms that'll allow him to disrupt passing lanes.  Will give you lockdown defense. Especially in pick-and-roll defense.  https://t.co/XKEFjdJ0H0",https://twitter.com/EDemirNBA/status/1517065615495733248,4,0,0,0.128,0.053,0.839,0.108
2022-04-21,kingbeams,Now the NBA world understands how great Steph Curry is because when KD was at the Golden state warriors he was getting wide open shots and lay ups every game because teams would throw the whole kitchen sink at Steph Curry as soon as he crossed half court so now KD is struggling,https://twitter.com/kingbeams/status/1517055655131103232,4,0,0,0.3182,0.048,0.881,0.071
2022-04-21,eth_donald,so you are telling me i missed nba free mint yesterday. ok,https://twitter.com/eth_donald/status/1517075393752272899,3,0,2,0.5106,0.14,0.51,0.35
2022-04-21,ybisking2,@D_ownbad @Defr29 @WhantomWhieves @Glorigeous @SundownRatio @gruzman28 @GriffinGuyPete @BeanNotHere @ybsucks @ToppyDreemurr @Pixelad3 @YoungboyControl @GodSaveTheRATIO @yaddleiswashed @4kt_IOwnYou @4KT_Flame @teeo1x @Tee123x @TeeNotRacistFr @YbBetterRIPBOZO @Vixbyyy @ybisbetterifear @OnTopYb @JayNBA_ @NBA_FlopBoy @notrealpain @Gregar_F @FloppaOwnsYou @Khosi2k1 @DrewskiGames24 @NBAELPRlMO @NbaDarthVader @NBAAmbassador @NBABaljeet @TwoFaceNBA own that nobody,https://twitter.com/ybisking2/status/1517091037575094273,3,0,1,0,0,1,0
2022-04-21,osgonewild,@bballverse_gg @TheRealMoBamba ⛹️I personally love this guy so much. He is so talented and so humble at the same time! Legend of the NBA future is part of #Basketballverse now!   Thanks Team-Basketballverse! &lt;3,https://twitter.com/OsGoneWild/status/1517073550271815680,3,0,0,0.9219,0,0.711,0.289
2022-04-21,sports___alerts,"Brandon Ingram recorded 55 points, 16 rebounds, and 13 assists in his first two career playoff games. Only two players in NBA history matched or exceeded those numbers in their first two playoff games (Oscar Robertson and LeBron James).  https://t.co/Kjsm91chd4",https://twitter.com/sports___alerts/status/1517088739977277441,3,1,0,0,0,1,0
2022-04-21,sodo_esq,"@LegalNaija @J_KGadzama @YCMaikyauSAN Definitely @YCMaikyauSAN ! It’s very clear he is what the bar need! The bar needs somebody accountable, brilliant, updated, fearless and passionate about the NBA, and that’s all YC. A man who knows that leadership is a service and a responsibility, and not a privilege✅",https://twitter.com/Sodo_Esq/status/1517059862940860417,3,1,0,0.9458,0,0.7,0.3
2022-04-21,gregmonroe54321,Bob Cousy  6× NBA champion  NBA MVP (1957)  13× NBA All-Star  2× NBA All-Star Game MVP  10× All-NBA First Team   2× All-NBA Second Team   8× NBA assists leader   NCAA champion (1947)  Redick couldn't win in college or the pros... He isn't even an All-Star... smh,https://twitter.com/GregMonroe54321/status/1517054838865285120,3,1,0,0.5312,0.099,0.757,0.144
2022-04-21,johnhancockcbc,"Raptors lose at buzzer in OT, 76ers up 3-0, Celtics Bulls also win NBA playoff gms, Truro Bearcats beat Valley in gm 7, adv to Maritime Jr A final vs Summerside, Oilers beat Dallas, Vegas also wins, Jays beat Red Sox.  @infoamcb @infomorning @portiaclarkcbc",https://twitter.com/johnhancockcbc/status/1517064400213008387,3,2,0,0.7003,0.054,0.797,0.149
2022-04-21,matissa15,Waiting on NBA tracking data from last night to update.  It feels like DeRozan was getting downhill more last night than in Game 1.  But that could just be my mind anchoring some of his biggest moments from the game and attributing them to the entire story.  Only time will tell.,https://twitter.com/matissa15/status/1517078909350776832,3,0,2,0.1901,0,0.966,0.034
2022-04-21,t1fhm,Gm   who was able to mint @NBAxNFT yesterday?  @NBA #Nba #NFT,https://twitter.com/t1fhm/status/1517080928576802816,3,0,2,0,0,1,0
2022-04-21,openstreamnft,Top Trending collections in the last hour by @OpenStreamNFT  1. @0xWarKittens 2. @weedsWTF 3. The Association NFT (NBA) 4. @MetacraftCC 5. @galverseNFT    #nfts #nftart #nftcommunity #openstream #nft  https://t.co/l5k9WKZdlQ,https://twitter.com/OpenStreamNFT/status/1517065741522161665,3,0,1,0.2023,0,0.938,0.062
2022-04-21,nftwhalealert,S̳weep: The Weirdos: Battle Royale: 55 Avius Animae: 30 WarKittens Genesis: 15 The Association NFT (NBA): 14 Your Daytime Fireworks - Firework Packets: 13  https://t.co/YSRIiZuSOs: 13 Shinsei Galverse Official: 12 Space Boo Official NFT: 11 PuzlPack (Punks): 10,https://twitter.com/nftwhalealert/status/1517080762268659713,3,0,0,-0.5719,0.118,0.882,0
2022-04-21,english_as,🏀 Not sure if George Karl understands that @boogiecousins would get drafted no matter what. His hard work made him get drafted 🤐  #NBA #Basketball  https://t.co/V85RNKXHD8,https://twitter.com/English_AS/status/1517065774824841216,3,0,0,-0.5365,0.209,0.75,0.041
2022-04-21,beerrttybrates,Trust me the NBA is doing fine without them 😂,https://twitter.com/beerrttybrates/status/1517080311112249345,3,0,1,0.6249,0,0.579,0.421
2022-04-21,gokulb61245420,"@AgentCF12 If the Bucks go through and they are without Middleton,they will sweep the Bucks. They have the bodies to stop Giannis and Jrue is not an NBA player during most games in playoffs",https://twitter.com/GokulB61245420/status/1517086366068523015,2,0,0,-0.296,0.062,0.937,0
2022-04-21,ibullinvest,"#iBulInsights💹 Hots  1. #Crusoe Energy, a clean Energy miner, raised a $350 million Series C round at a valuation of $1.75 billion;  2. There is a bug in the #NBA NFT contract, which causes non-whitelisted users to #mint this NFT;  https://t.co/pBHdTMVGKo",https://twitter.com/ibullinvest/status/1517065663973838848,2,0,0,0.7096,0,0.827,0.173
2022-04-21,tsnsimmer,Raps game was highly entertaining and a nice family night. NBA playoff ball is great tv.,https://twitter.com/TSNSimmer/status/1517077053421486080,2,0,0,0.8849,0,0.537,0.463
2022-04-21,realheb,@LegalNaija @J_KGadzama @YCMaikyauSAN @YCMaikyauSAN is definitely the man for the job! As Chairman of the NBA welfare committee @YCMaikyauSAN has been able to make significant difference within a short space!!! The bar needs @YCMaikyauSAN,https://twitter.com/realHEB/status/1517068297363247104,2,0,0,0.6876,0,0.845,0.155
2022-04-21,tommoorephilly,#NBA column: Some takeaways from the #Sixers' dramatic Game 3 playoff victory over the #Raptors:  https://t.co/b0VCWbaYB2 #76ers  https://t.co/yQjLnAIsGw,https://twitter.com/TomMoorePhilly/status/1517092037778190337,2,0,0,0,0,1,0
2022-04-21,ukchicagobulls,@NBA_UKFans Still can’t believe how popular they are! 😂,https://twitter.com/UKChicagoBulls/status/1517081418291200002,2,0,0,0.4753,0,0.694,0.306
2022-04-21,moe384k,"Miss listening to NBA YOUNGBOY, but it wasn’t good for my soul lol. Lectures by Mohamed Hoblos, Menk, Nouman Khan, Omar Suleiman. That’s growth.",https://twitter.com/Moe384k/status/1517079101689016320,2,0,0,0.8922,0.04,0.62,0.34
2022-04-21,newyawkgiant,🥳💰🥳💰🥳💰🥳💰🥳💰🥳💰🥳 ANOTHER ONE( @djkhaled voice)...  If you want ALL MY 100% FREE PLAYS...join my FREE discord!  All my bets get posted there before tip-off PLUS live betting opportunity in the chats!  Hop on the MONEY 🚂🚂   https://t.co/uhqUpgymyd #gamblingTwitter #nba  https://t.co/y9mmRONVMc,https://twitter.com/NewYawkGiant/status/1517070599675338752,2,0,0,0.8765,0.054,0.694,0.253
2022-04-21,isaiahin4,"reading the reply make me think that according to NBA twitter, being injured for the season makes you an instant bum despite being a superstar pre-injury",https://twitter.com/isaiahin4/status/1517066019709538305,2,0,1,-0.4019,0.101,0.899,0
2022-04-21,wiil_waal10,@kjannati I recently watched an interview of the NBA legend Hakeem Olajuwon and he said the same thing. He added that he fasts every Monday and Thursday throughout the year which helps.,https://twitter.com/Wiil_Waal10/status/1517069149410836481,2,0,1,0.3818,0,0.92,0.08
2022-04-21,aravantinosda,"@dogtheballer Nine times out of ten the best team in March Madness doesn’t win the whole thing. Nine times out of ten the best NBA team wins the whole thing. Reason being the format. In one game anything can happen, in seven games, the best team will most likely prevail.",https://twitter.com/AravantinosDA/status/1517083013150040064,2,0,1,0.9595,0.043,0.657,0.3
2022-04-21,d_ownbad,@Defr29 @WhantomWhieves @Glorigeous @SundownRatio @gruzman28 @GriffinGuyPete @BeanNotHere @ybsucks @ToppyDreemurr @Pixelad3 @YoungboyControl @GodSaveTheRATIO @yaddleiswashed @4kt_IOwnYou @4KT_Flame @teeo1x @Tee123x @TeeNotRacistFr @YbBetterRIPBOZO @Vixbyyy @ybisbetterifear @OnTopYb @JayNBA_ @NBA_FlopBoy @notrealpain @Gregar_F @FloppaOwnsYou @ybisking2 @Khosi2k1 @DrewskiGames24 @NBAELPRlMO @NbaDarthVader @NBAAmbassador @NBABaljeet @TwoFaceNBA Be ashamed of that banner,https://twitter.com/D_ownbad/status/1517090894037532673,2,0,1,-0.4767,0.074,0.926,0
2022-04-21,stiggabyte,"@Mxoh28 @yanganada @jabsils Nah my G I stopped torturing myself long ago, I use NBA league pass its just R140 a month.",https://twitter.com/stiggabyte/status/1517087064067649539,2,0,1,-0.743,0.327,0.673,0
2022-04-21,wiserye,Updated #NBA Championship &amp; East Winner odds @BetRivers PA   Title:  #Sixers have moved from 12/1 to 10/1  East:  #Sixers have moved from +550 to 4/1   #GamblingTwitter #76ers #NBAPlayoffs  https://t.co/lrmGePg5V9,https://twitter.com/WiseRye/status/1517077197181267968,2,0,1,0.7717,0,0.801,0.199
2022-04-21,openstreamnft,Top Trending collections in the last hour by @OpenStreamNFT  1. The Association NFT (NBA) 2. @solarbotsio 3. @TheWeirdosNFT 4. @galverseNFT 5. @0xWarKittens    #nft #nfts #openstream #nftart #nftcommunity  https://t.co/z78CTVQ8fS,https://twitter.com/OpenStreamNFT/status/1517080814957305856,2,0,0,0.2023,0,0.938,0.062
2022-04-21,__svet,@x47x74x thank god nba twitter got past the stage of pretending boogie was generational elite etc etc,https://twitter.com/__svet/status/1517066575924404224,2,0,0,0.61240000000000006,0,0.7,0.3
2022-04-21,sweetleftfootfm,I am so happy the NBA Playoffs are here 🥳,https://twitter.com/SweetLeftFootFM/status/1517081819744722944,2,0,0,0.6115,0,0.637,0.363
